{"componentChunkName":"component---src-templates-post-tsx","path":"/adventure/cody-peak-scramble/","result":{"data":{"mdx":{"id":"4b98ad34-5fc9-51ea-bbea-50ce5b9d2179","body":"var _excluded = [\"components\"];\n\nfunction _extends() { _extends = Object.assign || function (target) { for (var i = 1; i < arguments.length; i++) { var source = arguments[i]; for (var key in source) { if (Object.prototype.hasOwnProperty.call(source, key)) { target[key] = source[key]; } } } return target; }; return _extends.apply(this, arguments); }\n\nfunction _objectWithoutProperties(source, excluded) { if (source == null) return {}; var target = _objectWithoutPropertiesLoose(source, excluded); var key, i; if (Object.getOwnPropertySymbols) { var sourceSymbolKeys = Object.getOwnPropertySymbols(source); for (i = 0; i < sourceSymbolKeys.length; i++) { key = sourceSymbolKeys[i]; if (excluded.indexOf(key) >= 0) continue; if (!Object.prototype.propertyIsEnumerable.call(source, key)) continue; target[key] = source[key]; } } return target; }\n\nfunction _objectWithoutPropertiesLoose(source, excluded) { if (source == null) return {}; var target = {}; var sourceKeys = Object.keys(source); var key, i; for (i = 0; i < sourceKeys.length; i++) { key = sourceKeys[i]; if (excluded.indexOf(key) >= 0) continue; target[key] = source[key]; } return target; }\n\n/* @jsxRuntime classic */\n\n/* @jsx mdx */\nvar _frontmatter = {\n  \"title\": \"Cody Peak Scramble\",\n  \"subtitle\": \"An easy scramble to the top Cody Peak in Grand Teton National Park\",\n  \"date_created\": \"2020-04-26\",\n  \"date_last_updated\": false,\n  \"location\": \"Grand Teton National Park\",\n  \"category\": \"Day trip\",\n  \"tags\": [\"Solo\", \"Scramble\", \"Off trail\", \"Summit\"],\n  \"featured\": true,\n  \"draft\": false\n};\nvar layoutProps = {\n  _frontmatter: _frontmatter\n};\nvar MDXLayout = \"wrapper\";\nreturn function MDXContent(_ref) {\n  var components = _ref.components,\n      props = _objectWithoutProperties(_ref, _excluded);\n\n  return mdx(MDXLayout, _extends({}, layoutProps, props, {\n    components: components,\n    mdxType: \"MDXLayout\"\n  }), mdx(DropCapP, {\n    mdxType: \"DropCapP\"\n  }, \"In the early fall of 2020, between the first two COVID case spikes in the US, I was lucky enough be able to visit family in Jackson, Wyoming. The wife and I piled our two girls (1 and 3 at the time) into the car and made the two-day drive from the Bay Area to Jackson Hole.\"), mdx(\"p\", null, \"Parenting is hard. And nothing hammers that fact home like the experience of suddenly having two additional adults suddenly available to take on a share of the child care. Finding myself in one of my favorite places on Earth and without the guilt of burdening my wife with solo-parenting, the time was ripe for adventure.\"), mdx(\"p\", null, \"Over the last few years, I've been working to build my skills and experience in off trail hiking and scrambling. A safe, manageble objective for me was Cody Peak, a ~10,700 foot peak at the southern tip of Grand Teton National Park.\"), mdx(\"p\", null, \"An added bonus of the peak is that you can make use of the Jackson Hole ski mountain tram, turning a full day excursion into something doable in an afternoon. With COVID, the tram was shut down but I was still able ride the gondola up and save 3,000' of elevation gain. From there it was a relatively easy couple miles under the tram and towards Cody Bowl until the fun began.\"), mdx(CodyBowl, {\n    mdxType: \"CodyBowl\"\n  }), mdx(\"p\", null, \"The most challenging scrambling was right off the trail to reach the top of the right-most peak in the above photo. The scrambling was rather tame, easy class-3. I opted to take a route with a little more climbing for fun but was never concerned about a fall -- I'd bring an adventerous friend with no experience here. The gravely slopes actually felt sketchier as I was always a little worried about my feet slipping out from under me.\"), mdx(\"p\", null, \"After gaining the ridge it easy walking over some larger but sturdier loose stones to the summit of Cody Peak.\"), mdx(SS, {\n    mdxType: \"SS\"\n  }), mdx(\"p\", null, \"I did some exploring and ate some snacks at the summit before turning around and heading home. The next challenge is to extend the route and continue south from the peak until the ridgeline meets up with a trail and descends to Fish Creek Road.\"));\n}\n;\nMDXContent.isMDXComponent = true;","frontmatter":{"title":"Cody Peak Scramble","subtitle":"An easy scramble to the top Cody Peak in Grand Teton National Park","date_created":"April 26, 2020","tags":["Solo","Scramble","Off trail","Summit"],"category":"Day trip","date_last_updated":false},"fields":{"blog":"adventure"}}},"pageContext":{}},"staticQueryHashes":["764938311"]}